{
  "$schema": "https://raw.githubusercontent.com/Naptie/openmetro/main/schemas/v1/stops.schema.json",
  "schema_version": "1.0",
  "network_id": "cn-macau",
  "generated_at": "2026-10-12T11:04:41.520Z",
  "source": [],
  "records": [
    {
      "id": "airport-taipa",
      "station_id": "airport",
      "line_id": "cn-macau-line-taipa",
      "sequence": 11,
      "is_terminal": false,
      "location": {
        "lon": 113.579661,
        "lat": 22.156449,
        "crs": "gcj02"
      },
      "source_id": "mlm:taipa:11",
      "extras": {
        "line_key": "taipa"
      }
    },
    {
      "id": "barra-taipa",
      "station_id": "barra",
      "line_id": "cn-macau-line-taipa",
      "sequence": 0,
      "is_terminal": true,
      "location": {
        "lon": 113.534903,
        "lat": 22.180541,
        "crs": "gcj02"
      },
      "source_id": "mlm:taipa:0",
      "extras": {
        "line_key": "taipa"
      }
    },
    {
      "id": "cotai-east-taipa",
      "station_id": "cotai-east",
      "line_id": "cn-macau-line-taipa",
      "sequence": 9,
      "is_terminal": false,
      "location": {
        "lon": 113.574142,
        "lat": 22.14529,
        "crs": "gcj02"
      },
      "source_id": "mlm:taipa:9",
      "extras": {
        "line_key": "taipa"
      }
    },
    {
      "id": "cotai-west-taipa",
      "station_id": "cotai-west",
      "line_id": "cn-macau-line-taipa",
      "sequence": 5,
      "is_terminal": false,
      "location": {
        "lon": 113.56287,
        "lat": 22.142123,
        "crs": "gcj02"
      },
      "source_id": "mlm:taipa:5",
      "extras": {
        "line_key": "taipa"
      }
    },
    {
      "id": "east-asian-games-taipa",
      "station_id": "east-asian-games",
      "line_id": "cn-macau-line-taipa",
      "sequence": 8,
      "is_terminal": false,
      "location": {
        "lon": 113.57363,
        "lat": 22.139456,
        "crs": "gcj02"
      },
      "source_id": "mlm:taipa:8",
      "extras": {
        "line_key": "taipa"
      }
    },
    {
      "id": "hengqin-hengqin",
      "station_id": "hengqin",
      "line_id": "cn-macau-line-hengqin",
      "sequence": 1,
      "is_terminal": true,
      "location": {
        "lon": 113.550454,
        "lat": 22.136977,
        "crs": "gcj02"
      },
      "source_id": "mlm:hengqin:1",
      "extras": {
        "line_key": "hengqin"
      }
    },
    {
      "id": "jockey-club-taipa",
      "station_id": "jockey-club",
      "line_id": "cn-macau-line-taipa",
      "sequence": 2,
      "is_terminal": false,
      "location": {
        "lon": 113.5523,
        "lat": 22.15419,
        "crs": "gcj02"
      },
      "source_id": "mlm:taipa:2",
      "extras": {
        "line_key": "taipa"
      }
    },
    {
      "id": "lotus-hengqin",
      "station_id": "lotus",
      "line_id": "cn-macau-line-hengqin",
      "sequence": 0,
      "is_terminal": true,
      "location": {
        "lon": 113.56483,
        "lat": 22.136602,
        "crs": "gcj02"
      },
      "source_id": "mlm:hengqin:0",
      "extras": {
        "line_key": "hengqin"
      }
    },
    {
      "id": "lotus-taipa",
      "station_id": "lotus",
      "line_id": "cn-macau-line-taipa",
      "sequence": 6,
      "is_terminal": false,
      "location": {
        "lon": 113.56483,
        "lat": 22.136602,
        "crs": "gcj02"
      },
      "source_id": "mlm:taipa:6",
      "extras": {
        "line_key": "taipa"
      }
    },
    {
      "id": "must-taipa",
      "station_id": "must",
      "line_id": "cn-macau-line-taipa",
      "sequence": 10,
      "is_terminal": false,
      "location": {
        "lon": 113.575625,
        "lat": 22.150112,
        "crs": "gcj02"
      },
      "source_id": "mlm:taipa:10",
      "extras": {
        "line_key": "taipa"
      }
    },
    {
      "id": "ocean-taipa",
      "station_id": "ocean",
      "line_id": "cn-macau-line-taipa",
      "sequence": 1,
      "is_terminal": false,
      "location": {
        "lon": 113.546401,
        "lat": 22.154891,
        "crs": "gcj02"
      },
      "source_id": "mlm:taipa:1",
      "extras": {
        "line_key": "taipa"
      }
    },
    {
      "id": "pai-kok-taipa",
      "station_id": "pai-kok",
      "line_id": "cn-macau-line-taipa",
      "sequence": 4,
      "is_terminal": false,
      "location": {
        "lon": 113.559544,
        "lat": 22.147957,
        "crs": "gcj02"
      },
      "source_id": "mlm:taipa:4",
      "extras": {
        "line_key": "taipa"
      }
    },
    {
      "id": "seac-pai-van-spv",
      "station_id": "seac-pai-van",
      "line_id": "cn-macau-line-spv",
      "sequence": 1,
      "is_terminal": true,
      "location": {
        "lon": 113.566708,
        "lat": 22.128488,
        "crs": "gcj02"
      },
      "source_id": "mlm:spv:1",
      "extras": {
        "line_key": "spv"
      }
    },
    {
      "id": "stadium-taipa",
      "station_id": "stadium",
      "line_id": "cn-macau-line-taipa",
      "sequence": 3,
      "is_terminal": false,
      "location": {
        "lon": 113.556898,
        "lat": 22.151425,
        "crs": "gcj02"
      },
      "source_id": "mlm:taipa:3",
      "extras": {
        "line_key": "taipa"
      }
    },
    {
      "id": "taipa-ferry-terminal-taipa",
      "station_id": "taipa-ferry-terminal",
      "line_id": "cn-macau-line-taipa",
      "sequence": 12,
      "is_terminal": true,
      "location": {
        "lon": 113.578876,
        "lat": 22.160074,
        "crs": "gcj02"
      },
      "source_id": "mlm:taipa:12",
      "extras": {
        "line_key": "taipa"
      }
    },
    {
      "id": "union-hospital-spv",
      "station_id": "union-hospital",
      "line_id": "cn-macau-line-spv",
      "sequence": 0,
      "is_terminal": true,
      "location": {
        "lon": 113.568327,
        "lat": 22.135779,
        "crs": "gcj02"
      },
      "source_id": "mlm:spv:0",
      "extras": {
        "line_key": "spv"
      }
    },
    {
      "id": "union-hospital-taipa",
      "station_id": "union-hospital",
      "line_id": "cn-macau-line-taipa",
      "sequence": 7,
      "is_terminal": false,
      "location": {
        "lon": 113.568327,
        "lat": 22.135779,
        "crs": "gcj02"
      },
      "source_id": "mlm:taipa:7",
      "extras": {
        "line_key": "taipa"
      }
    }
  ]
}