{
  "$schema": "https://raw.githubusercontent.com/Naptie/openmetro/main/schemas/v1/stops.schema.json",
  "schema_version": "1.0",
  "network_id": "cn-urumqi",
  "generated_at": "2026-10-12T09:03:47.197Z",
  "source": [],
  "records": [
    {
      "id": "cn-urumqi-balou-1",
      "station_id": "cn-urumqi-balou",
      "line_id": "cn-urumqi-line-1",
      "sequence": 11,
      "is_terminal": false,
      "source_id": "八楼",
      "schematic": {
        "x": 1147,
        "y": 1189,
        "crs": "schematic"
      },
      "extras": {
        "line_short_name": "1",
        "amap_order": 11
      }
    },
    {
      "id": "cn-urumqi-beimen-1",
      "station_id": "cn-urumqi-beimen",
      "line_id": "cn-urumqi-line-1",
      "sequence": 16,
      "is_terminal": false,
      "source_id": "北门",
      "schematic": {
        "x": 1527,
        "y": 1591,
        "crs": "schematic"
      },
      "extras": {
        "line_short_name": "1",
        "amap_order": 16
      }
    },
    {
      "id": "cn-urumqi-botanical-garden-1",
      "station_id": "cn-urumqi-botanical-garden",
      "line_id": "cn-urumqi-line-1",
      "sequence": 5,
      "is_terminal": false,
      "source_id": "植物园",
      "schematic": {
        "x": 806,
        "y": 587,
        "crs": "schematic"
      },
      "extras": {
        "line_short_name": "1",
        "amap_order": 5
      }
    },
    {
      "id": "cn-urumqi-dadiwopu-1",
      "station_id": "cn-urumqi-dadiwopu",
      "line_id": "cn-urumqi-line-1",
      "sequence": 1,
      "is_terminal": false,
      "source_id": "大地窝堡",
      "schematic": {
        "x": 259,
        "y": 322,
        "crs": "schematic"
      },
      "extras": {
        "line_short_name": "1",
        "amap_order": 1
      }
    },
    {
      "id": "cn-urumqi-erdaoqiao-1",
      "station_id": "cn-urumqi-erdaoqiao",
      "line_id": "cn-urumqi-line-1",
      "sequence": 18,
      "is_terminal": false,
      "source_id": "二道桥",
      "schematic": {
        "x": 1527,
        "y": 1798,
        "crs": "schematic"
      },
      "extras": {
        "line_short_name": "1",
        "amap_order": 18
      }
    },
    {
      "id": "cn-urumqi-international-airport-1",
      "station_id": "cn-urumqi-international-airport",
      "line_id": "cn-urumqi-line-1",
      "sequence": 0,
      "is_terminal": true,
      "source_id": "国际机场",
      "schematic": {
        "x": 0,
        "y": 322,
        "crs": "schematic"
      },
      "extras": {
        "line_short_name": "1",
        "amap_order": 0
      }
    },
    {
      "id": "cn-urumqi-international-airport-apm",
      "station_id": "cn-urumqi-international-airport",
      "line_id": "cn-urumqi-line-apm",
      "sequence": 0,
      "is_terminal": true,
      "source_id": "国际机场",
      "schematic": {
        "x": 0,
        "y": 322,
        "crs": "schematic"
      },
      "extras": {
        "line_short_name": "机场捷运",
        "amap_order": 0
      }
    },
    {
      "id": "cn-urumqi-nanhu-north-road-1",
      "station_id": "cn-urumqi-nanhu-north-road",
      "line_id": "cn-urumqi-line-1",
      "sequence": 13,
      "is_terminal": false,
      "source_id": "南湖北路",
      "schematic": {
        "x": 1527,
        "y": 1296,
        "crs": "schematic"
      },
      "extras": {
        "line_short_name": "1",
        "amap_order": 13
      }
    },
    {
      "id": "cn-urumqi-nanhu-square-1",
      "station_id": "cn-urumqi-nanhu-square",
      "line_id": "cn-urumqi-line-1",
      "sequence": 14,
      "is_terminal": false,
      "source_id": "南湖广场",
      "schematic": {
        "x": 1527,
        "y": 1387,
        "crs": "schematic"
      },
      "extras": {
        "line_short_name": "1",
        "amap_order": 14
      }
    },
    {
      "id": "cn-urumqi-nanmen-1",
      "station_id": "cn-urumqi-nanmen",
      "line_id": "cn-urumqi-line-1",
      "sequence": 17,
      "is_terminal": false,
      "source_id": "南门",
      "schematic": {
        "x": 1527,
        "y": 1695,
        "crs": "schematic"
      },
      "extras": {
        "line_short_name": "1",
        "amap_order": 17
      }
    },
    {
      "id": "cn-urumqi-north-international-airport-apm",
      "station_id": "cn-urumqi-north-international-airport",
      "line_id": "cn-urumqi-line-apm",
      "sequence": 1,
      "is_terminal": true,
      "source_id": "国际机场北",
      "schematic": {
        "x": 274,
        "y": 43,
        "crs": "schematic"
      },
      "extras": {
        "line_short_name": "机场捷运",
        "amap_order": 1
      }
    },
    {
      "id": "cn-urumqi-sangong-1",
      "station_id": "cn-urumqi-sangong",
      "line_id": "cn-urumqi-line-1",
      "sequence": 3,
      "is_terminal": false,
      "source_id": "三工",
      "schematic": {
        "x": 734,
        "y": 381,
        "crs": "schematic"
      },
      "extras": {
        "line_short_name": "1",
        "amap_order": 3
      }
    },
    {
      "id": "cn-urumqi-santunbei-1",
      "station_id": "cn-urumqi-santunbei",
      "line_id": "cn-urumqi-line-1",
      "sequence": 20,
      "is_terminal": true,
      "source_id": "三屯碑",
      "schematic": {
        "x": 1527,
        "y": 2000,
        "crs": "schematic"
      },
      "extras": {
        "line_short_name": "1",
        "amap_order": 20
      }
    },
    {
      "id": "cn-urumqi-sports-center-1",
      "station_id": "cn-urumqi-sports-center",
      "line_id": "cn-urumqi-line-1",
      "sequence": 6,
      "is_terminal": false,
      "source_id": "体育中心",
      "schematic": {
        "x": 842,
        "y": 691,
        "crs": "schematic"
      },
      "extras": {
        "line_short_name": "1",
        "amap_order": 6
      }
    },
    {
      "id": "cn-urumqi-tieluju-1",
      "station_id": "cn-urumqi-tieluju",
      "line_id": "cn-urumqi-line-1",
      "sequence": 7,
      "is_terminal": false,
      "source_id": "铁路局",
      "schematic": {
        "x": 879,
        "y": 795,
        "crs": "schematic"
      },
      "extras": {
        "line_short_name": "1",
        "amap_order": 7
      }
    },
    {
      "id": "cn-urumqi-wangjialiang-1",
      "station_id": "cn-urumqi-wangjialiang",
      "line_id": "cn-urumqi-line-1",
      "sequence": 12,
      "is_terminal": false,
      "source_id": "王家梁",
      "schematic": {
        "x": 1369,
        "y": 1189,
        "crs": "schematic"
      },
      "extras": {
        "line_short_name": "1",
        "amap_order": 12
      }
    },
    {
      "id": "cn-urumqi-xiaoxigou-1",
      "station_id": "cn-urumqi-xiaoxigou",
      "line_id": "cn-urumqi-line-1",
      "sequence": 8,
      "is_terminal": false,
      "source_id": "小西沟",
      "schematic": {
        "x": 915,
        "y": 899,
        "crs": "schematic"
      },
      "extras": {
        "line_short_name": "1",
        "amap_order": 8
      }
    },
    {
      "id": "cn-urumqi-xinjiang-library-1",
      "station_id": "cn-urumqi-xinjiang-library",
      "line_id": "cn-urumqi-line-1",
      "sequence": 10,
      "is_terminal": false,
      "source_id": "新疆图书馆",
      "schematic": {
        "x": 988,
        "y": 1108,
        "crs": "schematic"
      },
      "extras": {
        "line_short_name": "1",
        "amap_order": 10
      }
    },
    {
      "id": "cn-urumqi-xinjiang-university-1",
      "station_id": "cn-urumqi-xinjiang-university",
      "line_id": "cn-urumqi-line-1",
      "sequence": 19,
      "is_terminal": false,
      "source_id": "新疆大学",
      "schematic": {
        "x": 1527,
        "y": 1895,
        "crs": "schematic"
      },
      "extras": {
        "line_short_name": "1",
        "amap_order": 19
      }
    },
    {
      "id": "cn-urumqi-xinxing-street-1",
      "station_id": "cn-urumqi-xinxing-street",
      "line_id": "cn-urumqi-line-1",
      "sequence": 15,
      "is_terminal": false,
      "source_id": "新兴街",
      "schematic": {
        "x": 1527,
        "y": 1491,
        "crs": "schematic"
      },
      "extras": {
        "line_short_name": "1",
        "amap_order": 15
      }
    },
    {
      "id": "cn-urumqi-xuanrendun-1",
      "station_id": "cn-urumqi-xuanrendun",
      "line_id": "cn-urumqi-line-1",
      "sequence": 2,
      "is_terminal": false,
      "source_id": "宣仁墩",
      "schematic": {
        "x": 550,
        "y": 322,
        "crs": "schematic"
      },
      "extras": {
        "line_short_name": "1",
        "amap_order": 2
      }
    },
    {
      "id": "cn-urumqi-yingbin-road-crossing-1",
      "station_id": "cn-urumqi-yingbin-road-crossing",
      "line_id": "cn-urumqi-line-1",
      "sequence": 4,
      "is_terminal": false,
      "source_id": "迎宾路口",
      "schematic": {
        "x": 770,
        "y": 483,
        "crs": "schematic"
      },
      "extras": {
        "line_short_name": "1",
        "amap_order": 4
      }
    },
    {
      "id": "cn-urumqi-zhongyinggong-1",
      "station_id": "cn-urumqi-zhongyinggong",
      "line_id": "cn-urumqi-line-1",
      "sequence": 9,
      "is_terminal": false,
      "source_id": "中营工",
      "schematic": {
        "x": 951,
        "y": 1004,
        "crs": "schematic"
      },
      "extras": {
        "line_short_name": "1",
        "amap_order": 9
      }
    }
  ]
}